{
  "$schema": "../schema/release.schema.json",
  "schema": 1,
  "id": "26.10.24",
  "date": "2026-10-24",
  "title": "DeepL for translation memories",
  "summary": "DeepL for translation memories, What's New in the app, a workflow picker that previews each workflow, and faster navigation.",
  "tags": [
    "translation-memory",
    "deepl",
    "whats-new",
    "projects",
    "cosmos",
    "content-research",
    "slate",
    "platform"
  ],
  "highlights": ["deepl", "whats-new", "workflow-picker"],
  "sections": [
    {
      "id": "deepl",
      "area": "translation-memory",
      "kind": "added",
      "title": "DeepL for translation memories",
      "note": "Translate VitraTM memories with DeepL, alongside Gemini and Azure.",
      "items": [
        {
          "body": "Use your own DeepL Free or Pro key"
        },
        {
          "body": "Language pickers show only what the engine can translate"
        },
        {
          "body": "Every memory shows its engine"
        },
        {
          "body": "Azure now covers every Microsoft Translator language"
        }
      ]
    },
    {
      "id": "whats-new",
      "area": "platform",
      "kind": "added",
      "title": "What's New",
      "items": [
        {
          "body": "Every release, right inside Universe",
          "link": {
            "label": "Open What's New",
            "path": "/whats-new"
          }
        }
      ]
    },
    {
      "id": "workflow-picker",
      "area": "projects",
      "kind": "changed",
      "title": "Preview a workflow before you pick it",
      "note": "See its diagram and the inputs it will ask for.",
      "items": [
        {
          "body": "Open or build a workflow in Cosmos without losing your form"
        },
        {
          "body": "Ready-made workflows become your own copy"
        }
      ]
    },
    {
      "id": "more",
      "area": "improvements",
      "kind": "changed",
      "title": "More updates",
      "items": [
        {
          "body": "Pick Content Research and Slate models in Provider Preferences"
        },
        {
          "body": "Content Research: drag ideas between stages"
        },
        {
          "body": "Faster moves between sections"
        },
        {
          "body": "Click anywhere on a card to open it"
        }
      ]
    },
    {
      "id": "fixes",
      "area": "fixes",
      "kind": "fixed",
      "title": "Fixes",
      "items": [
        {
          "body": "Lists no longer ignore clicks while refreshing"
        },
        {
          "body": "Closing dialogs no longer swallow your next click"
        },
        {
          "body": "Cancelling an upload no longer leaves a blank screen"
        }
      ]
    }
  ]
}
