{
  "$schema": "../schema/release.schema.json",
  "schema": 1,
  "id": "26.08.24",
  "date": "2026-08-24",
  "title": "See your approved terminology while you edit",
  "summary": "A term base panel in every memory-backed editor, step owners for Cosmos runs, and music and sound effect tracks on the Translate Video timeline.",
  "tags": [
    "translation-memory",
    "term-base",
    "cosmos",
    "step-owners",
    "translate-video",
    "audio-tracks"
  ],
  "backfill": true,
  "highlights": ["term-base", "step-owners", "audio-tracks"],
  "sections": [
    {
      "id": "term-base",
      "area": "translation-memory",
      "kind": "added",
      "title": "Term base in your editors",
      "note": "See approved terminology while you edit, in Translate Video, Translate Photo and Playground.",
      "items": [
        {
          "body": "Terms in your text and the full term base, A to Z"
        },
        {
          "body": "Term hits highlighted in Translate Video, forbidden terms struck through"
        }
      ]
    },
    {
      "id": "step-owners",
      "area": "cosmos",
      "kind": "added",
      "title": "Cosmos step owners",
      "items": [
        {
          "body": "Choose who owns each step when you start a run"
        },
        {
          "body": "Owners are notified when their step finishes and at approval gates"
        },
        {
          "body": "Change owners mid-run without touching the workflow"
        }
      ]
    },
    {
      "id": "audio-tracks",
      "area": "translate-video",
      "kind": "added",
      "title": "Audio tracks in Translate Video",
      "note": "Add music, sound effects and ambience to the timeline, mixed into the export.",
      "items": [
        {
          "body": "Upload or record a track"
        },
        {
          "body": "Trim by dragging an edge"
        },
        {
          "body": "Redesigned speaker voice mapping"
        }
      ]
    },
    {
      "id": "fixes",
      "area": "fixes",
      "kind": "fixed",
      "title": "Fixes",
      "items": [
        {
          "body": "Edit Folder opens with the folder's details"
        },
        {
          "body": "Subtitle Translation cards open the Subtitle tab"
        },
        {
          "body": "Transcript cards no longer overlap after changing page"
        }
      ]
    }
  ]
}
