{
  "$schema": "../schema/release.schema.json",
  "schema": 1,
  "id": "26.10.22",
  "date": "2026-10-22",
  "title": "Content Research and Slate",
  "summary": "Two new galaxies, Content Research and Slate, plus \"Why this translation\" on every translated line and cancel for Playground jobs.",
  "tags": [
    "content-research",
    "slate",
    "translation-origin",
    "projects",
    "playground",
    "quality",
    "integrations"
  ],
  "backfill": true,
  "highlights": ["content-research", "slate", "why-this-translation"],
  "sections": [
    {
      "id": "content-research",
      "area": "content-research",
      "kind": "added",
      "title": "Content Research",
      "note": "Research your market and plan content from your company profile.",
      "items": [
        {
          "body": "A report with content pillars, campaigns and a bank of ideas",
          "link": {
            "label": "Open Content Research",
            "path": "/galaxy/content-research"
          }
        },
        {
          "body": "Move ideas along a pipeline board and hand them to Slate or Blog"
        },
        {
          "body": "A shared calendar of holidays, marketing days and moments"
        },
        {
          "body": "Download branded PDF or Word reports"
        }
      ]
    },
    {
      "id": "slate",
      "area": "slate",
      "kind": "added",
      "title": "Slate",
      "note": "Work with an AI creative director on concepts, key visuals and briefs.",
      "items": [
        {
          "body": "Start a board from a brief or a research idea",
          "link": {
            "label": "Open Slate",
            "path": "/galaxy/slate"
          }
        },
        {
          "body": "Each concept has a palette, type and previews"
        },
        {
          "body": "Write a one-page brief and download it as a PDF"
        }
      ]
    },
    {
      "id": "why-this-translation",
      "area": "translation-memory",
      "kind": "added",
      "title": "Why this translation",
      "note": "A **Why** drawer shows who decided each wording and what the model was shown.",
      "items": [
        {
          "body": "Open it in memories, QE reports, Translate Video, Translate Photo and Playground"
        }
      ]
    },
    {
      "id": "more",
      "area": "improvements",
      "kind": "changed",
      "title": "More updates",
      "items": [
        {
          "body": "Projects: replace a file or keep both when names clash"
        },
        {
          "body": "Projects: deliverables named by file and language"
        },
        {
          "body": "Playground: cancel a running job"
        },
        {
          "body": "QE reports name what caused each error"
        },
        {
          "body": "Integrations: connect without leaving Universe"
        }
      ]
    },
    {
      "id": "fixes",
      "area": "fixes",
      "kind": "fixed",
      "title": "Fixes",
      "items": [
        {
          "body": "Translate Video: re-translating an unchanged line keeps its audio"
        },
        {
          "body": "QE scores no longer count markup as words"
        },
        {
          "body": "Duplicate glossary entries say the term already exists"
        },
        {
          "body": "Large zip downloads finish"
        },
        {
          "body": "Cancelling a Cosmos run ends its jobs"
        }
      ]
    }
  ]
}
