{
  "$schema": "../schema/release.schema.json",
  "schema": 1,
  "id": "2026.09.25",
  "date": "2026-09-25",
  "title": "Word aliases reopen after you cancel",
  "summary": "A fix for the Translate Video transcript editor, where a word's alias could not be reopened after cancelling.",
  "tags": ["translate-video", "pronunciation"],
  "backfill": true,
  "sections": [
    {
      "id": "fixes",
      "area": "fixes",
      "kind": "fixed",
      "title": "Fixes",
      "items": [
        {
          "title": "A word's alias would not reopen after you cancelled it.",
          "body": "In the Translate Video transcript, clicking an aliased word again did nothing once the **Alias Word** dialog had been cancelled. Each click now opens it."
        }
      ]
    }
  ]
}
