{
  "$schema": "../schema/release.schema.json",
  "schema": 1,
  "id": "26.10.27",
  "date": "2026-10-27",
  "title": "Enhancements to RTL documents",
  "summary": "Enhancements to RTL documents, improved PowerPoint text alignment and autofit, and fixes for French translations.",
  "tags": ["playground", "right-to-left", "office-translation", "pdf"],
  "highlights": ["documents"],
  "sections": [
    {
      "id": "documents",
      "area": "playground",
      "kind": "changed",
      "title": "Enhancements",
      "items": [
        { "body": "Enhancements to RTL documents in Word, PowerPoint, Excel and PDF" },
        { "body": "Improved PowerPoint text alignment and autofit" },
        { "body": "Improved Word text sizing after translation" },
        { "body": "Improved Word preview for RTL documents" }
      ]
    },
    {
      "id": "fixes",
      "area": "fixes",
      "kind": "fixed",
      "title": "Fixes",
      "items": [
        { "body": "Fixed stray bullets in French translations" },
        { "body": "Fixed the unsynced marker on edited segments" }
      ]
    }
  ]
}
