{
  "$schema": "../schema/release.schema.json",
  "schema": 1,
  "id": "26.08.19",
  "date": "2026-08-19",
  "title": "Hyperlocal image uploads no longer get blocked",
  "summary": "Hyperlocal template creatives, contact logos and product images upload reliably again.",
  "tags": ["hyperlocal", "uploads"],
  "backfill": true,
  "sections": [
    {
      "id": "fixes",
      "area": "fixes",
      "kind": "fixed",
      "title": "Fixes",
      "items": [
        {
          "body": "Hyperlocal image uploads no longer fail with a network error"
        }
      ]
    }
  ]
}
