{
  "$schema": "../schema/release.schema.json",
  "schema": 1,
  "id": "2026.10.14",
  "date": "2026-10-14",
  "title": "Plugin sign-in works again",
  "summary": "A fix for signing in to the Adobe and Figma plugins with an email code.",
  "tags": ["plugins", "sign-in"],
  "backfill": true,
  "sections": [
    {
      "id": "fixes",
      "area": "fixes",
      "kind": "fixed",
      "title": "Fixes",
      "items": [
        {
          "body": "The Adobe and Figma plugins can send a sign-in code again"
        }
      ]
    }
  ]
}
