{
  "$schema": "../schema/release.schema.json",
  "schema": 1,
  "id": "2026.08.24",
  "date": "2026-08-24",
  "title": "See your approved terminology while you edit",
  "summary": "A term base panel in every memory-backed editor, step owners for Cosmos runs, and music and sound effect tracks on the Translate Video timeline.",
  "tags": [
    "translation-memory",
    "term-base",
    "cosmos",
    "step-owners",
    "translate-video",
    "audio-tracks"
  ],
  "backfill": true,
  "highlights": ["term-base", "step-owners", "audio-tracks"],
  "sections": [
    {
      "id": "term-base",
      "area": "translation-memory",
      "kind": "added",
      "title": "Term base in your editors",
      "items": [
        {
          "title": "See approved terminology while you edit.",
          "body": "A terminology panel shows the terms in your text and the full term base A to Z, with grammar and concept details. It works with Phrase memories and stays hidden for other providers.",
          "children": [
            {
              "body": "Translate Video editor"
            },
            {
              "body": "Translate Photo image translator"
            },
            {
              "body": "Playground logs and playground text translation"
            }
          ]
        },
        {
          "title": "Term hits are highlighted in Translate Video,",
          "body": "and forbidden terms are struck through."
        }
      ]
    },
    {
      "id": "step-owners",
      "area": "cosmos",
      "kind": "added",
      "title": "Cosmos step owners",
      "items": [
        {
          "title": "Choose who owns each step when you start a run.",
          "body": "A new **Run settings** step in the run dialog has a searchable picker per step and can copy owners from the step above. Steps are listed in workflow order, matching the diagram beside them."
        },
        {
          "title": "Owners are notified",
          "body": "in the app and by push when their step finishes and at approval gates."
        },
        {
          "title": "Owners belong to the run.",
          "body": "They show on the run detail and can be changed mid-run, without touching the workflow."
        }
      ]
    },
    {
      "id": "audio-tracks",
      "area": "translate-video",
      "kind": "added",
      "title": "Translate Video",
      "items": [
        {
          "title": "Add music, sound effects and ambience to the timeline.",
          "body": "Audio tracks belong to the whole process rather than a transcript card, and are mixed into the export. The timeline has collapsible Video, Dialogue and Audio sections."
        },
        {
          "title": "Upload or record a track.",
          "body": "Review it before adding it. The full take is always kept."
        },
        {
          "title": "Trim by dragging an edge.",
          "body": "Times show milliseconds, and waveforms stay just as detailed when trimmed."
        },
        {
          "title": "Mute is for preview only.",
          "body": "To silence a track in the export, set its volume to 0."
        },
        {
          "kind": "changed",
          "title": "Speaker voice mapping redesigned.",
          "body": "A Speakers toolbar with select all and an \"x of n assigned\" count, and a Clone or Library choice per speaker that stays put when the selection changes. All speakers start unselected, and the video panel stays in view on narrow screens."
        },
        {
          "kind": "changed",
          "title": "Subtitle translation has its own icon",
          "body": "in process tables, so it no longer looks like subtitle generation."
        }
      ]
    },
    {
      "id": "fixes",
      "area": "fixes",
      "kind": "fixed",
      "title": "Fixes",
      "items": [
        {
          "title": "Edit Folder opened blank.",
          "body": "The dialog now shows the folder's details. The same fix applies to editing Memory categories and Prompt library categories."
        },
        {
          "title": "Subtitle Translation cards opened the Video upload tab.",
          "body": "The cards on the dashboard and the Translate Video page now open the Subtitle tab, and it stays selected after a reload."
        },
        {
          "title": "Transcript cards overlapped after changing page.",
          "body": "Cards now sit at their real height on every page, and filtered language and voice lists no longer keep the previous list's row sizes."
        },
        {
          "title": "Verifying cards on one transcript page added them to another.",
          "body": "Each page now shows only its own cards."
        }
      ]
    }
  ]
}
