{
  "$schema": "../schema/release.schema.json",
  "schema": 1,
  "id": "26.09.18",
  "date": "2026-09-18",
  "title": "Glossaries and QE quality reports",
  "summary": "Glossaries, MQM quality reports where you translate, Brand Kit as its own page, multi-file Playground translation and versioned prompts.",
  "tags": ["translation-memory", "glossaries", "quality", "brand-kit", "playground", "prompts"],
  "backfill": true,
  "highlights": ["translation-memory", "quality", "brand-kit"],
  "sections": [
    {
      "id": "translation-memory",
      "area": "translation-memory",
      "kind": "added",
      "title": "Glossaries",
      "note": "Keep names verbatim and wordings fixed, beside term bases and style guides.",
      "items": [
        {
          "body": "Mark entries do-not-translate or case-sensitive"
        },
        {
          "body": "Import and export CSV and Excel"
        },
        {
          "body": "Start a style guide without files"
        }
      ]
    },
    {
      "id": "quality",
      "area": "quality",
      "kind": "added",
      "title": "QE quality reports",
      "note": "Score a translation with MQM in Translate Video, Translate Photo and Playground.",
      "items": [
        {
          "body": "Errors by severity, with corrected text per segment"
        },
        {
          "body": "Apply the suggested fixes from the report"
        },
        {
          "body": "Download the report as a PDF"
        }
      ]
    },
    {
      "id": "brand-kit",
      "area": "platform",
      "kind": "changed",
      "title": "Brand Kit",
      "items": [
        {
          "body": "Brand Kit has its own page in the nav rail"
        }
      ]
    },
    {
      "id": "more",
      "area": "improvements",
      "kind": "changed",
      "title": "More updates",
      "items": [
        {
          "body": "Playground: translate several files at once, with live progress"
        },
        {
          "body": "Prompts and memories keep every version"
        },
        {
          "body": "Translate Photo: send Quick Create images straight to translation"
        },
        {
          "body": "Dashboard is now **Home**, and Translation Memory is now **TMS**"
        }
      ]
    },
    {
      "id": "fixes",
      "area": "fixes",
      "kind": "fixed",
      "title": "Fixes",
      "items": [
        {
          "body": "Running out of credits in the video editor explains the shortfall"
        },
        {
          "body": "The memory picker lists your memories"
        },
        {
          "body": "Re-importing a term base no longer duplicates concepts"
        },
        {
          "body": "Re-imported TM segments keep their metadata"
        }
      ]
    }
  ]
}
