{
  "$schema": "../schema/release.schema.json",
  "schema": 1,
  "id": "26.10.15",
  "date": "2026-10-15",
  "title": "Magic Layers makes any image editable",
  "summary": "Magic Layers makes any image editable, Blog gets several reviewers and translation history, and Image Creator reads documents.",
  "tags": ["magic-layers", "image-creator", "brand-kit", "blog", "playground", "xliff"],
  "backfill": true,
  "highlights": ["magic-layers", "blog"],
  "sections": [
    {
      "id": "magic-layers",
      "area": "translate-photo",
      "kind": "added",
      "title": "Magic Layers",
      "note": "Turn any image into editable text and objects, then translate and export it.",
      "items": [
        {
          "body": "Move, hide or reorder objects",
          "link": {
            "label": "Open Magic Layers",
            "path": "/galaxy/translate-photo/magic-layers"
          }
        },
        {
          "body": "**Use brand fonts** sets text in your brand kit's fonts"
        },
        {
          "body": "Open Image Creator images with **Edit in Magic Layers**"
        }
      ]
    },
    {
      "id": "blog",
      "area": "blog",
      "kind": "changed",
      "title": "Blog",
      "items": [
        {
          "body": "Several reviewers per post"
        },
        {
          "body": "Version history for every translation"
        },
        {
          "body": "New posts link to your own pages"
        },
        {
          "body": "Set authors and publishers per language"
        }
      ]
    },
    {
      "id": "more",
      "area": "improvements",
      "kind": "changed",
      "title": "More updates",
      "items": [
        {
          "body": "Image Creator: attach documents to a chat"
        },
        {
          "body": "Brand Kit: upload your own fonts"
        },
        {
          "body": "Playground: readable XLIFF tags and a side-by-side Code tab"
        }
      ]
    },
    {
      "id": "fixes",
      "area": "fixes",
      "kind": "fixed",
      "title": "Fixes",
      "items": [
        {
          "body": "Image Creator renders with a brand kit go through"
        },
        {
          "body": "Blog: **Choose another** topic works"
        },
        {
          "body": "Language lists no longer show the previous memory"
        },
        {
          "body": "Translate Video aliases are saved"
        },
        {
          "body": "Assets says when a folder couldn't load"
        }
      ]
    }
  ]
}
