{
  "$schema": "../schema/release.schema.json",
  "schema": 1,
  "id": "26.09.22",
  "date": "2026-09-22",
  "title": "Context for every text in AI translation",
  "summary": "Per-text context in AI translation, Quick Create chat groups, one shared voice library, two-line subtitles and Canva sign-in.",
  "tags": ["translation-memory", "quick-create", "voices", "translate-video", "canva", "pricing"],
  "backfill": true,
  "highlights": ["translation-quality", "voices", "translate-video"],
  "sections": [
    {
      "id": "translation-quality",
      "area": "translation-memory",
      "kind": "added",
      "title": "Translation quality",
      "note": "AI translation uses more of what you already know.",
      "items": [
        {
          "body": "Each text can carry its own context, such as an i18n key"
        },
        {
          "body": "The model sees approved memory wording for phrases inside each text"
        },
        {
          "body": "Long documents keep the same wording throughout"
        },
        {
          "body": "Terms now match in Chinese, Japanese, Korean and Thai"
        }
      ]
    },
    {
      "id": "voices",
      "area": "playground",
      "kind": "changed",
      "title": "Voices",
      "items": [
        {
          "body": "One voice library across Playground and Translate Video"
        },
        {
          "body": "Freed clones are re-created automatically"
        },
        {
          "body": "6,400+ new native voices"
        }
      ]
    },
    {
      "id": "translate-video",
      "area": "translate-video",
      "kind": "changed",
      "title": "Translate Video",
      "items": [
        {
          "body": "Subtitles on two lines of 42 characters"
        },
        {
          "body": "Split view scrolls both languages together"
        },
        {
          "body": "Sharper exports"
        }
      ]
    },
    {
      "id": "more",
      "area": "improvements",
      "kind": "changed",
      "title": "More updates",
      "items": [
        {
          "body": "Quick Create: chat groups with shared rules"
        },
        {
          "body": "Canva: sign in with your email and stay connected"
        },
        {
          "body": "One language order in every picker"
        },
        {
          "body": "QE reports cost 4 credits per source word"
        }
      ]
    },
    {
      "id": "fixes",
      "area": "fixes",
      "kind": "fixed",
      "title": "Fixes",
      "items": [
        {
          "body": "The QE **Unverified only** toggle works"
        },
        {
          "body": "Audio-only exports with lip-synced cards work on retry"
        },
        {
          "body": "480p and 360p exports have no black bars"
        },
        {
          "body": "Adding a language no longer overwrites earlier ones"
        }
      ]
    }
  ]
}
