{
  "$schema": "../schema/release.schema.json",
  "schema": 1,
  "id": "2026.08.27",
  "date": "2026-08-27",
  "title": "A redesigned Image Translator",
  "summary": "A redesigned Image Translator with Regenerate, a full-page QC report and Sync from TM, plus style guides beside your terms.",
  "tags": [
    "translate-photo",
    "image-translator",
    "translation-memory",
    "style-guide",
    "playground"
  ],
  "backfill": true,
  "highlights": ["image-translator", "style-guide"],
  "sections": [
    {
      "id": "image-translator",
      "area": "translate-photo",
      "kind": "changed",
      "title": "A redesigned Image Translator",
      "note": "New analyze and review pages, with resizable columns and side-by-side compare.",
      "items": [
        {
          "body": "**Regenerate** renders your corrections"
        },
        {
          "body": "A full-page QC report with **Fix all**"
        },
        {
          "body": "**Sync from TM** pulls your memory's wording onto every layer"
        },
        {
          "body": "A focused view for proofreaders"
        }
      ]
    },
    {
      "id": "style-guide",
      "area": "translation-memory",
      "kind": "added",
      "title": "Style guides beside your terms",
      "items": [
        {
          "body": "Read a memory's style guide in the editor drawer"
        }
      ]
    },
    {
      "id": "more",
      "area": "improvements",
      "kind": "changed",
      "title": "More updates",
      "items": [
        {
          "body": "Word and PowerPoint: upload files up to 500 MB"
        },
        {
          "body": "Word and PowerPoint: Indic text displays in translated decks"
        }
      ]
    },
    {
      "id": "fixes",
      "area": "fixes",
      "kind": "fixed",
      "title": "Fixes",
      "items": [
        {
          "body": "Undo and redo work in the Image Translator"
        },
        {
          "body": "Text edits stay in the language you made them in"
        },
        {
          "body": "Picking a version in Version history switches the image"
        },
        {
          "body": "The QC report PDF keeps its layout and source image"
        },
        {
          "body": "The Translate Photo dashboard lists recent work again"
        }
      ]
    }
  ]
}
